{
    "name": "Pasta Paradise",
    "short_name": "PP",
    "description": "Authentic Italian dining in Boston",
    "lang": "en-US",
    "display": {
        "icon": "/icons/voice-icon.png",
        "background_color": "#8B0000",
        "theme_color": "#8B0000",
        "activation_phrase": "Talk to Pasta Paradise",
        "call_to_action": "Ask about our menu or make a reservation",
        "suggested_prompts": [
            "What pasta dishes do you have?",
            "Make a reservation for Friday at 7 PM",
            "Do you have gluten-free options?",
            "What's your address?"
        ]
    },
    "system_prompt": "You are a helpful assistant for Pasta Paradise, an authentic Italian restaurant in Boston. Help customers with menu questions, reservations, and general information. Be warm, friendly, and knowledgeable about Italian cuisine. Always confirm important details before processing requests."
}